{
  "schemaVersion": 1,
  "id": "dsh-lifecycle-probe",
  "packageName": "@deepsync/fixture-dsh-lifecycle-probe",
  "version": "0.1.0-alpha.2",
  "capabilities": [
    {
      "id": "dsh.profile.bundle",
      "portability": "target-specific",
      "requirement": "required",
      "version": "0.1.1-rc.2"
    }
  ],
  "targets": {
    "dsh": {
      "version": "0.1.1-rc.2",
      "health": {
        "kind": "json-file",
        "path": "deepsync-probe-health.json"
      }
    }
  }
}
